{
  "schemaVersion": 1,
  "verifiedOn": "2026-08-28",
  "symptomId": "door-will-not-close",
  "evidenceRules": [
    "Model identity never implies symptom coverage.",
    "No evidence transfer across brands or incompatible topologies.",
    "Generic category guidance without brand/category applicability cannot create a candidate.",
    "Purchase-ready requires exact complete-code-to-part compatibility plus separately verified commerce evidence."
  ],
  "profiles": [
    {
      "id": "washer-door-closure-observation",
      "scope": "Brand-specific front-load or top-load washer cohorts only",
      "checks": [
        "Stop the cycle and wait for the door/lid lock indicator to clear.",
        "Remove clothing or debris caught at the visible door/lid edge.",
        "Wipe only the visible latch/strike contact area with a soft damp cloth.",
        "Close the door/lid firmly once; do not force it or bypass the lock."
      ],
      "exclusions": [
        "No brand transfer",
        "Front-load gasket steps do not apply to top-load lids",
        "Do not bypass, force, or replace a lock"
      ],
      "exceptionRule": "Exact manual wins; absent a brand/topology source, remain unsupported."
    },
    {
      "id": "dishwasher-door-closure-observation",
      "scope": "Brand-specific built-in dishwasher cohorts only",
      "checks": [
        "Confirm dishes, handles, and utensils stay inside the rack envelope.",
        "Push both racks fully home and remove visible debris at the door seal.",
        "Check for visible cabinet or countertop interference without loosening hardware.",
        "Close the door once; do not force the latch."
      ],
      "exclusions": [
        "No cross-brand latch assumptions",
        "AutoRelease/open-dry branches only on equipped models",
        "No hinge/spring/alignment repair"
      ],
      "exceptionRule": "Use model-prefix and feature gates stated by the manufacturer."
    },
    {
      "id": "refrigerator-door-closure-observation",
      "scope": "Brand-specific full-size refrigerator cohorts, split by side-by-side and French-door topology",
      "checks": [
        "Move food packages, bins, drawers, or shelves that block closure.",
        "Wipe visible gasket soil with a soft cloth and mild soapy water.",
        "Check only the topology-specific mullion/flap position when the source and model support it.",
        "Close the door gently and observe whether it stays shut."
      ],
      "exclusions": [
        "No sealed-system or hinge repair",
        "No heavy-unit movement",
        "French-door mullion step not used on side-by-side models"
      ],
      "exceptionRule": "Model manual confirms flap/mullion, drawer, showcase-door, and leveling branches."
    }
  ],
  "sources": {
    "lg-front-washer-door": {
      "id": "lg-front-washer-door",
      "kind": "manufacturer-troubleshooting",
      "title": "LG front-load washer dE/dE1/dE2 door errors",
      "url": "https://www.lg.com/us/support/help-library/front-load-washer-what-are-de-de1-and-de2-error-codes--1400508168566",
      "publisher": "LG",
      "appliesTo": "LG front-load washers; all-model article with model-dependent visuals",
      "verifiedOn": "2026-08-28",
      "quality": "primary"
    },
    "lg-top-washer-lid": {
      "id": "lg-top-washer-lid",
      "kind": "manufacturer-troubleshooting",
      "title": "LG top-load washer door will not close",
      "url": "https://www.lg.com/us/support/help-library/troubleshooting-an-lg-top-load-washer-door-that-will-not-close-properly-CT10000010-20152830489687",
      "publisher": "LG",
      "appliesTo": "LG top-load washers; all-model article with model-dependent visuals",
      "verifiedOn": "2026-08-28",
      "quality": "primary"
    },
    "samsung-washer-door": {
      "id": "samsung-washer-door",
      "kind": "manufacturer-troubleshooting",
      "title": "Samsung washer door error guidance",
      "url": "https://www.samsung.com/us/support/troubleshoot/TSG10000997/",
      "publisher": "Samsung",
      "appliesTo": "Samsung washers; exact error meaning varies by model and manual",
      "verifiedOn": "2026-08-28",
      "quality": "primary"
    },
    "whirlpool-front-washer-door": {
      "id": "whirlpool-front-washer-door",
      "kind": "manufacturer-troubleshooting",
      "title": "Whirlpool front-load washer door latching",
      "url": "https://producthelp.whirlpool.com/Laundry/Washers/Product_Info/Washer_Product_Assistance/Latching_a_Front_Load_Washer_Door",
      "publisher": "Whirlpool",
      "appliesTo": "Whirlpool front-load washers",
      "verifiedOn": "2026-08-28",
      "quality": "primary"
    },
    "whirlpool-top-washer-lid": {
      "id": "whirlpool-top-washer-lid",
      "kind": "manufacturer-troubleshooting",
      "title": "Whirlpool top-load washer lid not latching",
      "url": "https://producthelp.whirlpool.com/Laundry/Washers/Top_Load_Washer/Operation/Not_Operating/Lid_Not_Latching_-_Washer",
      "publisher": "Whirlpool",
      "appliesTo": "Whirlpool top-load washers",
      "verifiedOn": "2026-08-28",
      "quality": "primary"
    },
    "maytag-front-washer-door": {
      "id": "maytag-front-washer-door",
      "kind": "manufacturer-troubleshooting",
      "title": "Maytag front-load washer door will not lock",
      "url": "https://producthelp.maytag.com/Laundry/Washers/Front_Load_Washers/Door_Issues/Door_Will_Not_Lock_or_Unlock_-_Front_Load_Washer",
      "publisher": "Maytag",
      "appliesTo": "Maytag front-load washers",
      "verifiedOn": "2026-08-28",
      "quality": "primary"
    },
    "maytag-top-washer-lid": {
      "id": "maytag-top-washer-lid",
      "kind": "manufacturer-troubleshooting",
      "title": "Maytag top-load washer LdL lid-lock error",
      "url": "https://producthelp.maytag.com/Laundry/Washers/Top_Load_Washer/Error_Codes_or_Flashing_Lights/Other_Error_Codes/LdL_-_Error_Code",
      "publisher": "Maytag",
      "appliesTo": "Maytag top-load washers that display LdL; models without that code need manual confirmation",
      "verifiedOn": "2026-08-28",
      "quality": "primary"
    },
    "amana-front-washer-door": {
      "id": "amana-front-washer-door",
      "kind": "manufacturer-troubleshooting",
      "title": "Amana front-load washer door will not lock",
      "url": "https://producthelp.amana.com/Laundry/Washers/Front_Load_Washers/Door_Issues/Door_Will_Not_Lock_-_Front_Load_Washer",
      "publisher": "Amana",
      "appliesTo": "Amana front-load washers",
      "verifiedOn": "2026-08-28",
      "quality": "primary"
    },
    "amana-top-washer-lid": {
      "id": "amana-top-washer-lid",
      "kind": "manufacturer-troubleshooting",
      "title": "Amana top-load washer lid not latching",
      "url": "https://producthelp.amana.com/Laundry/Washers/Top_Load_Washer/Operation/Not_Operating/Lid_Not_Latching_-_Washer",
      "publisher": "Amana",
      "appliesTo": "Amana top-load washers",
      "verifiedOn": "2026-08-28",
      "quality": "primary"
    },
    "electrolux-front-washer-door": {
      "id": "electrolux-front-washer-door",
      "kind": "manufacturer-troubleshooting",
      "title": "Electrolux E41 washer door-open guidance",
      "url": "https://owner.electrolux.com/support-articles/article/1820509-laundry-front-loading-washer-displaying-error-code-e41-door-is-open-",
      "publisher": "Electrolux",
      "appliesTo": "Electrolux front-load washers",
      "verifiedOn": "2026-08-28",
      "quality": "primary"
    },
    "whirlpool-dishwasher-door": {
      "id": "whirlpool-dishwasher-door",
      "kind": "manufacturer-troubleshooting",
      "title": "Whirlpool dishwasher door will not close",
      "url": "https://producthelp.whirlpool.com/Dishwashers/Dishwasher/Door_Concerns/Door_Will_Not_Close/Door_Will_Not_Close_-_Dishwasher",
      "publisher": "Whirlpool",
      "appliesTo": "Whirlpool built-in dishwashers; Open Door Dry step only on equipped models",
      "verifiedOn": "2026-08-28",
      "quality": "primary"
    },
    "kitchenaid-dishwasher-door": {
      "id": "kitchenaid-dishwasher-door",
      "kind": "manufacturer-troubleshooting",
      "title": "KitchenAid dishwasher door will not close",
      "url": "https://producthelp.kitchenaid.com/Dishwashers/Dishwasher/Door_Concerns/Door_Will_Not_Close/Door_Will_Not_Close_-_Dishwasher",
      "publisher": "KitchenAid",
      "appliesTo": "KitchenAid built-in dishwashers; Open Door Dry step only on equipped models",
      "verifiedOn": "2026-08-28",
      "quality": "primary"
    },
    "samsung-dishwasher-door": {
      "id": "samsung-dishwasher-door",
      "kind": "manufacturer-troubleshooting",
      "title": "Samsung dishwasher door does not close",
      "url": "https://www.samsung.com/us/support/troubleshooting/TSG01001919/",
      "publisher": "Samsung",
      "appliesTo": "Samsung dishwashers; AutoRelease step only on equipped models",
      "verifiedOn": "2026-08-28",
      "quality": "primary"
    },
    "ge-dishwasher-door": {
      "id": "ge-dishwasher-door",
      "kind": "manufacturer-troubleshooting",
      "title": "GE dishwasher door will not latch",
      "url": "https://products.geappliances.com/appliance/gea-support-search-content?contentId=17527",
      "publisher": "GE Appliances",
      "appliesTo": "GE dishwashers; adjustable-rack note only for listed model prefixes",
      "verifiedOn": "2026-08-28",
      "quality": "primary"
    },
    "bosch-dishwasher-door": {
      "id": "bosch-dishwasher-door",
      "kind": "manufacturer-troubleshooting",
      "title": "Bosch dishwasher troubleshooting",
      "url": "https://www.bosch-home.com/us/owner-support/dishwashers/troubleshooting",
      "publisher": "Bosch",
      "appliesTo": "Bosch dishwashers; AutoAir and error-code branches are model-specific",
      "verifiedOn": "2026-08-28",
      "quality": "primary"
    },
    "frigidaire-dishwasher-door": {
      "id": "frigidaire-dishwasher-door",